{
  "hearing_id": "H-5",
  "hearing_number": 5,
  "stage": "FULL_MERITS",
  "issues_addressed": ["ISS-001", "ISS-002", "ISS-003", "ISS-004", "ISS-005", "ISS-006", "ISS-007", "ISS-008", "ISS-009"],
  "findings": [
    {
      "finding": "ISS-001 (limitation/jurisdiction) has been left undecided through Hearings 1-4 - correctly, at each of those case-management-testing stages, because deciding a threshold jurisdictional question on an admittedly assumed foundation would itself have been unsafe. It cannot be left undecided at this, the final hearing: there is no Hearing 6, and a full-merits Tribunal that declines to rule on whether it has jurisdiction has not actually decided the case. The claimant carries the legal burden of proving in-time presentation (ERA 1996 s.111(2)(a), independently verified live against legislation.gov.uk per procedure/limitation.md). On the record actually before this Tribunal: the EDT is ASSUMED, not documented (F-002); the ACAS EC certificate date (Day B) is likewise ASSUMED (F-003); the ACAS EC contact date (Day A), without which the ERA 1996 s.207B calculation cannot be run at all, is UNKNOWN (F-004); and - a distinct and more basic gap first identified at Hearing 4 - the actual date the ET1 was, or will be, presented is not stated anywhere in this matter's record at all. A Tribunal cannot find in-time presentation proved when it cannot even confirm presentation occurred. This burden has not been discharged.",
      "severity": "FATAL",
      "issue_id": "ISS-001"
    },
    {
      "finding": "In the alternative, and independently of the jurisdictional finding: ISS-002 (ordinary unfair dismissal) fails on its own terms because continuity of employment under ERA 1996 s.108 (F-008) remains completely unproven - no contract, statement of terms, or HR service record exists in this record, and the claimant's own case theory (final/case_theory_memo.md Section 3) itself runs this head only as a contingent fallback for exactly this reason. An evidential burden that has never been engaged with any document cannot be found discharged.",
      "severity": "FATAL",
      "issue_id": "ISS-002"
    },
    {
      "finding": "ISS-003 (s.103A automatic unfair dismissal) and ISS-004 (s.47B whistleblowing detriment) - the claimant's own correctly-chosen lead heads, resting on sound and binding doctrine (Kuzel v Roche Products [2008] EWCA Civ 380; Beatt v Croydon Health Services NHS Trust [2017] EWCA Civ 401; NHS Manchester v Fecitt [2011] EWCA Civ 1190, now correctly corrected for ERA 1996 s.47B(1A)-(1E)) - fail on this record for want of anything to apply that doctrine to. Kuzel requires the claimant to adduce 'some evidence' that the disclosure was the reason (or a ground) for the treatment; that exercise cannot be performed where the disclosure's own content, recipient, and date (F-010) and its sequencing against the disciplinary process (F-012) are both unstated, and where the Respondent's actual stated reason for dismissal (F-020) has never been produced. No Evidence Ledger exists anywhere in this matter (confirmed again this session: no evidence/ directory, no schemas/evidence.schema.json record). Two closing submissions that both correctly state the same doctrine and both candidly concede the same missing facts are advocacy about a case, not a demonstration of one.",
      "severity": "FATAL",
      "issue_id": "ISS-003"
    },
    {
      "finding": "A further, independent obstacle to ISS-003/ISS-004, raised for the first time in this matter's live record by the opposing case and not answered by any reply: ERA 1996 s.43B(1), as amended by Enterprise and Regulatory Reform Act 2013 s.17 (reversing Parkins v Sodexho Ltd [2002] IRLR 109), requires the worker to hold a reasonable belief that the disclosure was made in the public interest, per Chesterton Global Ltd v Nurmohamed [2017] EWCA Civ 979. The claimant's own case theory (final/case_theory_memo.md Section 3 and Section 7) declines to engage this test at all, on the stated ground that Chesterton is not yet logged in authorities.json - a defensible authority-integrity position, but one that leaves the point standing entirely unrebutted before this Tribunal. Since F-010 discloses nothing about the disclosure's content, this Tribunal cannot find, on this record, that the public-interest element is met even provisionally. This compounds the causation gap in the finding above; it does not merely repeat it.",
      "severity": "SERIOUS",
      "issue_id": "ISS-004"
    },
    {
      "finding": "ISS-009 (procedural fairness/remedy: Polkey deduction, ACAS Code uplift) does not arise, because no liability head survives to reach it. Independently, and as found at Hearings 3-4, it would in any event be unassessable: the disciplinary process file and the Respondent's stated reason for dismissal (F-020) have never been produced, so neither a Polkey percentage nor an ACAS Code compliance finding can be made even hypothetically.",
      "severity": "MATERIAL",
      "issue_id": "ISS-009"
    },
    {
      "finding": "ISS-005 (disability status, gateway), ISS-006 (discrimination arising from disability), ISS-007 (reasonable adjustments), and ISS-008 (victimisation) remain struck from Hearing 1, on a pleading defect never cured across five hearings: no impairment is named (F-021), no PCP is identified (F-024), and no protected act under Equality Act 2010 s.27(2) is identified (F-023). The claimant's own case theory (final/case_theory_memo.md Section 4) does not attempt to revive them and expressly agrees Hearing 1's strike was correctly reasoned, not merely correctly ordered. The opposing case (Part B.4) likewise does not attempt to defeat them on any ground beyond the same pleading gap, and candidly names a real risk to the Respondent (Gallop v Newport City Council) that would apply if they were ever properly pleaded. Neither side asks this Tribunal to revisit the strike, and it is not revisited.",
      "severity": "MINOR",
      "issue_id": "ISS-005"
    },
    {
      "finding": "Authority-integrity finding, carried forward and now unmet for a fourth consecutive hearing: British Home Stores Ltd v Burchell, Iceland Frozen Foods Ltd v Jones, Polkey v A E Dayton Services Ltd, Chesterton Global Ltd v Nurmohamed, J v DLA Piper UK LLP, and the ERRA 2013 s.17 amendment - all relied on in the opposing case, and Chesterton specifically outcome-relevant to the finding above - remain absent from authorities.json, which independently re-read this session still runs only to AUTH-007. This does not change today's disposition, because the underlying propositions are treated as correctly stated general doctrine (none is doubted as fabricated, and the opposing case's own verification narrative for all six is candid about tier and sources), but a five-hearing run that never once cures a repair first ordered at Hearing 2 is itself a finding about this matter's own record-keeping, not only about the parties' cases.",
      "severity": "MATERIAL",
      "issue_id": "ISS-004"
    },
    {
      "finding": "The Respondent's identity (F-025) remains unconfirmed - directed at every prior hearing, still not addressed by either side at the final hearing. A claim cannot proceed to a judgment capable of enforcement against an unidentified party; this is a freestanding pleading defect, not a mere restatement of the jurisdictional finding.",
      "severity": "SERIOUS",
      "issue_id": "ISS-001"
    }
  ],